book_slug,chapter_no,verse_no,ref,source_sections,brief_summary,key_characters,core_emotion,lesson_seed,created_at,validation_errors,is_valid
mahabharat,1,40,Bhima's Forest Ordeal,Section CLIII,"After narrowly escaping the burning lac house, the disguised Pandavas fled through a dense and perilous forest. Bhima, with his immense strength, bore the burden of carrying his mother Kunti and his brothers, clearing a path through the wilderness. As evening descended, they were overcome by exhaustion, hunger, and thirst in the desolate woods. Kunti's desperate plea for water spurred Bhima to action. He ventured alone into the darkness, found a lake, quenched his thirst, and collected water for his family. Returning, he found Kunti and his brothers asleep on the cold, bare ground. This sight filled him with profound grief and anger at their plight and the injustice from the Kauravas. Despite his rage, he respected Yudhishthira's virtue and chose to remain awake, vigilantly guarding his sleeping family through the night.","[""Bhima"", ""Kunti"", ""Yudhishthira""]",Protective grief and resolve,"Even in the direst circumstances, true strength lies in self-sacrifice and unwavering commitment to protect loved ones. Bearing responsibility for others can be a heavy burden, but it reveals the depth of one's character.",2026-03-14T10:06:39.909118+00:00,[],True
mahabharat,1,41,Bhishma's Valor and Vichitravirya's Demise,Section CII,"After Chitrangada's death, Bhishma governed the kingdom for his minor brother, Vichitravirya, under Satyavati's command. When Vichitravirya came of age, Bhishma sought to arrange his marriage. Hearing of a Swayamvara for the three beautiful daughters of the King of Kasi, Bhishma traveled to Varanasi. There, he boldly declared his intention to take the maidens by force for his brother, challenging all assembled monarchs. A fierce battle ensued where Bhishma single-handedly defeated countless kings with his extraordinary prowess. King Salya then specifically challenged Bhishma, leading to another intense duel. Bhishma ultimately vanquished Salya, sparing his life, and triumphantly returned to Hastinapura with the Kasi princesses for Vichitravirya, demonstrating his unwavering commitment to his family's welfare.","[""Bhishma"", ""Vichitravirya"", ""Satyavati"", ""King Salya"", ""Daughters of the King of Kasi""]",Fierce determination and valor,"Fulfilling one's commitments, especially to family, often demands immense courage and the willingness to confront significant obstacles. True dedication means facing challenges head-on for the welfare of those you serve.",2026-03-14T10:06:46.505109+00:00,[],True
mahabharat,1,42,Departure and Vidura's Warning,Section CXLVII,"The Pandavas, filled with sorrow, depart Hastinapura for Varanavata, bidding farewell to elders and citizens. The distressed citizens openly criticize King Dhritarashtra's injustice, but Yudhishthira calms them, asserting their duty to obey the king. As they travel, the wise Vidura, using a secret Mlechchha tongue, subtly warns Yudhishthira about a hidden danger: the house awaiting them is made of inflammable materials. He advises Yudhishthira to understand the schemes of foes, protect himself, and prepare an escape route, comparing it to a jackal's den with many outlets. Yudhishthira confirms his understanding. Later, Kunti, curious about the cryptic exchange, asks Yudhishthira, who explains Vidura's warning about the lac house and the necessity of finding an escape. The Pandavas then arrive at Varanavata.","[""Yudhishthira"", ""Vidura"", ""Kunti""]",Foreboding and cautious wisdom,"Be aware of hidden dangers and always have a contingency plan. Trust your instincts and those who offer genuine, discreet warnings.",2026-03-14T10:06:53.754795+00:00,[],True
mahabharat,1,43,Devayani and Sarmishtha's Conflict and Resolution,Section LXXVIII | Section LXXIX | Section LXXX | Section LXXXI,"After Kacha mastered the Sanjivani mantra, Indra played a prank by mixing up the clothes of bathing maidens. Among them, Sarmishtha, daughter of King Vrishaparvan, mistakenly took Devayani's garments. This led to a heated argument where Sarmishtha, fueled by pride in her royal lineage, insulted Devayani, the daughter of the revered sage Sukra, calling her the child of a ""hired chanter"" and ""beggar."" Enraged, Sarmishtha pushed Devayani into a dry well and left her for dead. Later, King Yayati, out hunting, discovered Devayani in the well and, recognizing her as a Brahmana's daughter, rescued her. Devayani, still furious, refused to return to Vrishaparvan's city and sent her maid to inform her father, Sukra, of the grave insult and assault. Sukra, finding his distressed daughter, initially tried to pacify her with wisdom about controlling anger and the importance of forgiveness, but Devayani remained deeply hurt and insistent on justice.","[""Devayani"", ""Sarmishtha"", ""Sukra"", ""Yayati""]",Prideful rage and humiliation,Unchecked pride and anger can lead to destructive actions and deep emotional wounds. Learning to control one's temper and practice forgiveness is essential for peace and well-being.,2026-03-14T10:07:00.626897+00:00,[],True
mahabharat,1,44,Discovering the Deception,Section CXLVIII | Section CXLIX,"The Pandavas arrive in Varanavata, welcomed by its citizens, and are led by Purochana to a grand new palace. After ten nights, they move into a specially built mansion, which Purochana calls 'The Blessed Home.' Yudhishthira, however, immediately senses the deception, recognizing the smell of lac and other inflammable materials. He realizes Vidura's earlier cryptic warning was about this very house, designed by Duryodhana to burn them alive. Despite Bhima's suggestion to return to their previous quarters, Yudhishthira decides they must feign trust while secretly planning their escape to avoid a hasty attack. Soon after, a skilled miner, sent by Vidura, arrives and secretly constructs a subterranean passage from their chamber. The Pandavas live cautiously, maintaining a facade of contentment to deceive Purochana and the local citizens, all while preparing for the inevitable fire.","[""Yudhishthira"", ""Bhima"", ""Purochana"", ""Vidura"", ""The Miner""]",Vigilance amidst treachery,"When faced with hidden dangers, it's wise to observe carefully, trust your instincts, and prepare a discreet escape plan rather than reacting impulsively.",2026-03-14T10:07:06.475914+00:00,[],True
mahabharat,1,45,Dushmanta's Hunt and Arrival at Kanwa's Ashrama,Section LXVIII | Section LXIX | Section LXX,"King Dushmanta, a powerful and virtuous ruler, embarked on a grand hunting expedition with a vast army. His subjects admired him as he set out, filling the air with the sounds of war and celebration. The king and his forces plunged into a dense forest, engaging in a relentless and violent hunt. They killed countless animals, including tigers and elephants, causing immense chaos and fear among the wildlife. The forest, once teeming with life, was left disturbed and depleted. Exhausted from the extensive hunt, Dushmanta, now accompanied by only a single follower and suffering from hunger and thirst, traversed a barren desert. Finally, he arrived at a tranquil and beautiful forest, described as a peaceful retreat for ascetics, marking a stark contrast to the destructive hunt he had just concluded.","[""Dushmanta""]",From violent hunt to serene arrival,"Intense action and pursuit, however grand, often lead to a profound need for rest and a change of environment to find inner peace. It highlights the natural rhythm of exertion and calm.",2026-03-14T10:07:13.645139+00:00,[],True
mahabharat,1,46,Earth's Plea and the Divine Incarnations,Section LXIV,"After Parasurama cleared the earth of Kshatriyas, a virtuous age emerged where all orders followed dharma. However, this peace was shattered when powerful Asuras, defeated by the celestials, began incarnating as arrogant kings. These Asura-born rulers oppressed all beings, disrupting the established order and virtue, causing immense suffering. The Earth, groaning under their weight and tyranny, became distressed and sought refuge with Lord Brahman. Knowing her plight beforehand, Brahman convened the gods and commanded them to descend to Earth, taking human forms to counter the oppressive Asuras and restore balance. The gods, along with Gandharvas and Apsaras, accepted this divine decree, preparing to incarnate and fulfill their mission to relieve Earth's burden.","[""Earth"", ""Brahman"", ""Asuras"", ""Gods""]",Divine Resolve to Restore Balance,"When overwhelming forces disrupt peace and virtue, appealing to a higher power and collective resolve can initiate the path to restoration. It reminds us that even the most burdened can find relief through divine intervention and concerted effort.",2026-03-14T10:07:21.543758+00:00,[],True
mahabharat,1,47,Escape from the Burning House,Section CL | Section CLI | Section CLII,"The Pandavas, living unsuspectingly in the lac house built by Purochana under Duryodhana's orders, realize the time for escape is near. Yudhishthira orchestrates a plan. During an almsgiving feast, a Nishada woman and her five sons become intoxicated and fall asleep in the house. As a violent wind blows, Bhima sets fire to the lac mansion, ensuring Purochana perishes in the flames. The Pandavas, along with Kunti, escape through a secret subterranean tunnel. The townspeople, witnessing the inferno, mourn the supposed death of the Pandavas and condemn Duryodhana and Dhritarashtra. Meanwhile, Vidura's trusted agent meets the fleeing Pandavas in the forest, providing a special boat to cross the Ganga, ensuring their safe passage and continued secrecy as they journey onward. Dhritarashtra feigns sorrow upon hearing the news.","[""Yudhishthira"", ""Bhima"", ""Kunti"", ""Purochana"", ""Vidura"", ""Nishada Woman""]",Cunning survival and desperate escape,"Even in dire situations, careful planning, quick action, and trusted allies can provide a path to safety. Vigilance is key when facing hidden dangers.",2026-03-14T10:07:27.931011+00:00,[],True
mahabharat,1,48,"Genealogies of Gods, Asuras, and Celestial Beings",Section LXV | Section LXVI,"King Janamejaya asks Vaisampayana to narrate the origins of gods, asuras, and all creatures. Vaisampayana explains that Brahman's spiritual son, Marichi, begot Kasyapa. Kasyapa, in turn, married thirteen daughters of Daksha, becoming the progenitor of vast and diverse lineages. From Aditi, the twelve Adityas, including Vishnu and Indra, were born, representing the celestial gods. Diti gave birth to powerful Asuras like Hiranyakasipu and his descendants, while Danu bore numerous other formidable Asuras. Other daughters of Daksha became mothers to various beings such as the Nagas (serpents), Suparnas (like Garuda and Aruna), Gandharvas, Apsaras, and even kine and Brahmanas. This intricate genealogy highlights the interconnectedness of all beings, tracing their diverse powers and natures back to common divine and semi-divine ancestors, setting the stage for the epic's conflicts.","[""Brahman"", ""Kasyapa"", ""Daksha"", ""Aditi"", ""Diti"", ""Danu""]",Awe of creation's diversity,"Understanding our origins, whether personal or cosmic, reveals the deep interconnectedness of all life. Even seemingly disparate beings share common roots, suggesting a fundamental unity beneath apparent differences.",2026-03-14T10:07:37.170484+00:00,[],True
mahabharat,1,49,Hidimva's Love and Bhima's Battle,Section CLIV | Section CLV | Section CLVI,"A cannibalistic Rakshasa named Hidimva, smelling human flesh, sends his sister, Hidimbi, to capture the sleeping Pandavas. Upon finding them, Hidimbi is captivated by the powerful and handsome Bhima, who is awake guarding his family. Overwhelmed by love, she decides to defy her brother, transforms into a beautiful woman, and approaches Bhima. She confesses her feelings, warns him of her brother's intent, and offers to whisk him and his family away to safety. Bhima, however, refuses to abandon his sleeping mother and brothers, asserting his own strength and dismissing Hidimva as a threat. Impatient, Hidimva arrives, enraged to find his sister in human form, seemingly enamored with a human. Bhima, confident in his prowess, prepares to face the furious Rakshasa, assuring Hidimbi of their safety.","[""Hidimva"", ""Hidimbi"", ""Bhima""]",Love and protective resolve,"Loyalty to family can be a powerful motivator, even when faced with new attractions or threats. Sometimes, unexpected connections can arise in the most dangerous circumstances.",2026-03-14T10:07:43.504941+00:00,[],True
mahabharat,1,50,Janamejaya's Demand for the Full Narrative,Section LXII,"King Janamejaya, having heard a concise version of the Mahabharata, expresses his profound dissatisfaction and demands a complete, detailed narration from Sage Vaisampayana. He is particularly curious about the reasons behind the virtuous Pandavas' suffering, their restraint despite immense provocation, and the complex choices made by figures like Yudhishthira, Bhima, and Draupadi. Janamejaya questions why such a devastating conflict occurred and why the innocent endured persecution. Vaisampayana agrees to recount the extensive epic, composed by Vyasa over three years, highlighting its immense scope and spiritual significance. He explains that the Mahabharata is equivalent to the Vedas, capable of cleansing sins, granting victory, and offering profound insights into Dharma, Artha, Kama, and Moksha, promising a comprehensive understanding of life's deepest truths.","[""Janamejaya"", ""Vaisampayana""]",Profound curiosity and anticipation,True understanding often requires delving beyond surface-level accounts and patiently exploring the intricate details and motivations behind significant events. A comprehensive narrative can reveal deeper wisdom and context.,2026-03-14T10:07:51.416590+00:00,[],True
mahabharat,1,51,Janamejaya's Vengeance: The Snake Sacrifice Begins,Section XLIX | Section L | Section LI | Section LII,"King Janamejaya, seeking to understand his father Parikshit's death, questions his ministers. They recount how Parikshit, a virtuous ruler, became lost and hungry during a hunt. Encountering the silent Rishi Shamika, Parikshit, in a fit of frustration, placed a dead snake on the sage's shoulders. Shamika's powerful and wrathful son, Sringin, upon learning of the insult, cursed Parikshit to die from Takshaka's venom within seven nights. Though Shamika sent a disciple to warn the king, and Parikshit took precautions, fate intervened. On the seventh day, the healer Rishi Kasyapa, capable of neutralizing Takshaka's poison, was intercepted by Takshaka himself. After demonstrating his potent venom on a tree, Takshaka convinced Kasyapa to abandon his mission, sealing Parikshit's doom and setting the stage for Janamejaya's vengeful snake sacrifice.","[""Janamejaya"", ""Parikshit"", ""Shamika Rishi"", ""Sringin"", ""Takshaka"", ""Kasyapa""]",Vengeful anger and its consequences,"Rash actions fueled by anger can lead to unforeseen and severe consequences, affecting not only oneself but also others. Even well-intentioned efforts can be thwarted by powerful forces set in motion by such actions.",2026-03-14T10:07:55.960732+00:00,[],True
mahabharat,1,52,Jaratkaru's Vow and Astika's Conception,Section XLV | Section XLVI | Section XLVII | Section XLVIII,"Jaratkaru, a severe ascetic, discovers his ancestors trapped in a pit, held by a single thread representing his lineage, which is being gnawed by time. They reveal their dire predicament stems from his lack of a son, urging him to marry and procreate to ensure their salvation. Initially hesitant due to his vow of celibacy, Jaratkaru agrees, but only under strict conditions: his bride must share his name, be offered as alms, and require no maintenance from him. After much wandering and a public plea in a forest, the serpent king Vasuki, whose sister also happens to be named Jaratkaru, offers her to him. Jaratkaru accepts this unique proposal, thus fulfilling his ancestors' plea and setting the stage for the birth of Astika, who is destined to save the serpents.","[""Jaratkaru (Rishi)"", ""Jaratkaru (Maiden)"", ""Vasuki"", ""Pitris (Ancestors)""]",Reluctant acceptance of ancestral duty,"Personal vows, however sacred, may need to be re-evaluated when faced with a greater, unavoidable responsibility towards one's lineage or community.",2026-03-14T10:08:03.196579+00:00,[],True
mahabharat,1,53,"Kacha, Devayani, and the Sanjivani Vidya",Section LXXVI | Section LXXVII,"The gods, facing defeat by the Asuras who are continually revived by their priest Sukra's Sanjivani Vidya, send Vrihaspati's son Kacha to learn this secret. Kacha becomes Sukra's disciple and cultivates a deep bond with Sukra's daughter, Devayani, who falls in love with him. Fearing Kacha will acquire the knowledge, the Asuras repeatedly kill him—chopping his body, mixing him with ocean water, and even burning him to ashes and mixing them in Sukra's wine. Each time, Devayani's intense grief and unwavering insistence compel Sukra to use his Sanjivani Vidya to revive Kacha, bringing him back from the dead. This cycle highlights Kacha's perilous mission and Devayani's profound attachment.","[""Kacha"", ""Devayani"", ""Sukra""]",Unwavering devotion and perilous pursuit,"True devotion can overcome seemingly insurmountable obstacles. However, pursuing a difficult goal often requires immense personal sacrifice and resilience from all involved.",2026-03-14T10:08:10.037763+00:00,[],True
mahabharat,1,54,Kanika's Counsel of Deception,Section CXLII,"King Dhritarashtra, consumed by anxiety over the Pandavas' increasing power, consults his minister Kanika for advice on how to deal with them. Kanika, a master of political science, delivers a chilling counsel advocating ruthless and deceptive tactics. He advises Dhritarashtra to always be ready to strike, conceal his own weaknesses, exploit those of his foes, and destroy enemies completely, even if it requires feigning friendship or using any means, open or secret. Kanika illustrates his point with a story about a cunning jackal who, through clever lies and manipulation, successfully turns a tiger, mouse, wolf, and mongoose against each other to claim a deer carcass for himself. The counsel emphasizes that a king must prioritize self-preservation and power above all else, showing no mercy to perceived threats.","[""Dhritarashtra"", ""Kanika"", ""Jackal""]",Calculated ruthlessness,"Fear of losing power can drive individuals to embrace extreme, unethical strategies. Such cunning, while seemingly effective in the short term, erodes trust and isolates those who employ it.",2026-03-14T10:08:16.886084+00:00,[],True
mahabharat,1,55,Key Characters Incarnate on Earth,Section LXVII,"Janamejaya, seeking to understand the epic's origins, asks Vaisampayana about the earthly incarnations of gods, Danavas, and other beings. Vaisampayana begins by detailing how numerous powerful Danavas, or Asuras, were reborn among humans, primarily as mighty kings and formidable warriors. This extensive list includes prominent figures like Viprachitti becoming Jarasandha, Hiranyakasipu incarnating as Sisupala, Samhlada as Salya, and Kalanemi as Kansa. Many other formidable Asuras were also reborn into royal lineages across different kingdoms, each endowed with great strength and influence. This mass incarnation of celestial and demonic entities sets the foundational stage for the grand narrative of the Mahabharata, explaining the extraordinary prowess and inherent conflicts among the future generations of kings and heroes.","[""Janamejaya"", ""Vaisampayana"", ""Jarasandha"", ""Sisupala"", ""Salya"", ""Kansa""]",Unveiling destined roles,The origins of individuals and their inherent natures often shape the course of future events. Understanding these foundational elements can provide insight into unfolding conflicts and relationships.,2026-03-14T10:08:23.817260+00:00,[],True
mahabharat,1,56,Kunti's Secret Son: Karna's Birth and Abandonment,Section CXI,"Pritha, adopted by Kuntibhoja and known as Kunti, diligently served guests. Pleased by her hospitality, the sage Durvasa granted her a boon: a mantra to summon any deity to bear children. Out of maidenly curiosity, Kunti invoked the Sun god, Surya. Despite her initial reluctance and fear, Surya insisted their union must bear fruit, resulting in the immediate birth of Karna, endowed with natural armor and earrings. To conceal her secret and preserve her honor, Kunti sorrowfully placed the infant in a basket and cast him into the river. He was discovered and raised by Radha and her Suta husband, who named him Vasusena. Karna grew into a formidable warrior, known for his immense generosity. Indra, disguised as a Brahmana, later tricked Karna into giving up his divine armor, receiving a powerful dart in return, and thus earning the name Karna (the cutter).","[""Kunti"", ""Durvasa"", ""Surya"", ""Karna"", ""Radha"", ""Indra""]","Fear, secrecy, and destiny's path","Decisions made in fear or secrecy can have profound, unforeseen consequences that shape not only our own lives but also the destinies of others. Sometimes, what we try to hide becomes a pivotal part of a larger story.",2026-03-14T10:08:28.658332+00:00,[],True
mahabharat,1,57,Narada's Warning and the Tale of Tilottama,CCX | CCXI | CCXII | CCXIII | CCXIV,"After establishing their kingdom in Indraprastha, the Pandavas lived contentedly with Draupadi. One day, the sage Narada visited them and, observing their unique marital arrangement, warned them against potential disunion. To illustrate his point, he recounted the tale of two powerful Daitya brothers, Sunda and Upasunda. These brothers were incredibly close, sharing everything and acting as one. They undertook severe ascetic penances on the Vindhya mountains, enduring extreme hardships and resisting all divine temptations. Impressed, Brahma appeared and offered them boons. They requested mastery over weapons, illusion, immense strength, shape-shifting, and immortality. Brahma granted all but immortality, allowing them to choose their vulnerability. They chose to be invulnerable to all except each other, a choice that would later prove fateful. Narada used this story to emphasize the importance of establishing clear rules to maintain harmony among the Pandavas.","[""Narada"", ""Yudhishthira"", ""Draupadi"", ""Sunda"", ""Upasunda"", ""Brahma""]",Warning against discord,"Even the strongest bonds can be broken by unchecked desire, especially when resources or affections are shared without clear boundaries. Setting clear rules and boundaries is crucial to prevent conflict, even among those who are deeply connected.",2026-03-14T10:08:35.818940+00:00,[],True
mahabharat,1,58,Overview of the Bharata Story,Section LXI,"Vaisampayana begins narrating the Bharata story to Janamejaya, detailing the growing animosity between the Pandavas and Kurus. After their father's death, the Pandavas' strength and popularity fueled Duryodhana's jealousy, prompting him, Karna, and Sakuni to plot their destruction. Bhima survived poisoning and drowning attempts, thanks to Vidura's secret protection. The wicked Duryodhana then constructed a lac house in Varanavata to burn them alive. Guided by Vidura, the Pandavas escaped, burning Purochana instead. In the forest, Bhima slew Hidimba, marrying her sister and fathering Ghatotkacha. They lived disguised in Ekachakra, where Bhima killed the Rakshasa Vaka. They won Draupadi at her swayamvara and returned to Hastinapura, only to be sent to Khandavaprastha. There, they prospered, subjugating many kingdoms. Arjuna's exile led to his marriage with Subhadra. Later, Arjuna and Krishna helped Agni burn the Khandava forest, receiving divine weapons and Maya's palace. Duryodhana's envy of this palace led to the fateful dice game, exiling the Pandavas for thirteen years.","[""Pandavas"", ""Kunti"", ""Duryodhana"", ""Karna"", ""Sakuni"", ""Vidura"", ""Dhritarashtra"", ""Draupadi""]",Jealousy and persecution leading to resilience,"Even when facing intense jealousy and repeated attempts at harm, resilience and wise counsel can help overcome adversity. Unchecked envy, however, often leads to destructive actions.",2026-03-14T10:08:53.761395+00:00,[],True
mahabharat,1,59,Pandu's Curse and Retreat to the Forest,Section CXIV | Section CXVIII | Section CXIX,"After his military conquests, King Pandu retires to the forest with his wives, Kunti and Madri, to live a life of hunting and contemplation. One day, while hunting, he shoots a deer and its mate during their intimate moment. The dying deer reveals itself to be Rishi Kindama, who had assumed animal form for privacy. Enraged by the interruption and the violent act during such a vulnerable time, Kindama curses Pandu. The curse dictates that Pandu will die the very instant he attempts to engage in sexual intercourse with any of his wives. This tragic curse forces Pandu into a life of celibacy, profoundly impacting his ability to father children and secure the Kuru lineage, setting the stage for future events.","[""Pandu"", ""Kunti"", ""Madri"", ""Rishi Kindama""]",Fatal consequence of a rash act,"Impulsive actions can have unforeseen and irreversible consequences, sometimes leading to profound personal tragedy and altering the course of one's life.",2026-03-14T10:09:01.527033+00:00,[],True
