book_slug,chapter_no,verse_no,ref,source_sections,brief_summary,key_characters,core_emotion,lesson_seed,created_at,validation_errors,is_valid
mahabharat,1,60,Plotting the Lac House,Section CXLIII | Section CXLIV | Section CXLV | Section CXLVI,"Driven by intense jealousy over the citizens' preference for Yudhishthira as king, Duryodhana, along with Sakuni, Karna, and Duhsasana, conspired to eliminate the Pandavas. He convinced King Dhritarashtra to send Kunti and her five sons to Varanavata, where a highly flammable house of lac was secretly built by Purochana. The sinister plan was to burn them alive inside. However, the wise Vidura, discerning the treacherous plot through subtle signs, secretly warned Kunti. He arranged for their escape via a hidden tunnel and a boat across the Ganges, advising them to flee into the forest. The lac house was set ablaze, consuming an innocent Nishada woman, her children, and Purochana, leading everyone to believe the Pandavas had perished. Dhritarashtra feigned grief, while the Pandavas, guided by Vidura's foresight, successfully evaded the deadly trap.","[""Duryodhana"", ""Vidura"", ""Kunti"", ""Pandavas"", ""Dhritarashtra""]",Treachery and survival,"Even when faced with extreme malice and betrayal, wise counsel and vigilance can provide a path to safety. Unchecked jealousy can lead to destructive and cruel actions.",2026-03-14T10:09:10.178911+00:00,[],True
mahabharat,1,61,Puru's Sacrifice and Yayati's Redemption,Section LXXXIV | Section LXXXV,"King Yayati, cursed with premature old age by the sage Usanas, sought to regain his youth to continue enjoying life. He asked his elder sons to exchange their youth for his decrepitude, but they all refused, citing the hardships of old age, and were cursed by their father. Finally, his youngest son, Puru, humbly agreed to the exchange. Yayati, restored to youth, indulged in a thousand years of worldly pleasures, ruling justly and enjoying life to its fullest. However, at the end of this period, he realized that desires are never truly satisfied by indulgence; rather, they intensify like fire fed with butter. Acknowledging this profound truth, Yayati returned Puru's youth and accepted his own old age, understanding the ultimate futility of endless material pursuit.","[""Yayati"", ""Puru"", ""Usanas""]",The futility of endless desire,"True contentment isn't found in endlessly pursuing desires, but in understanding their nature and learning to let go. Selfless sacrifice, like Puru's, often leads to profound wisdom and unexpected blessings for all involved.",2026-03-14T10:09:18.021881+00:00,[],True
mahabharat,1,62,Royal Marriages and Pandu's Conquests,Section CIX | Section CX | Section CXII | Section CXIII | Section CXIV,"Under Bhishma's wise rule, the Kuru kingdom flourished, experiencing a golden age of prosperity and happiness. The young princes Dhritarashtra, Pandu, and Vidura grew into accomplished men, excelling in both scholarly pursuits and martial arts. Despite Dhritarashtra's blindness and Vidura's birth, Pandu was crowned king. Recognizing the crucial need for dynastic continuity, Bhishma initiated marriage proposals. He successfully secured Gandhari, the virtuous daughter of King Suvala, for Dhritarashtra. Out of profound devotion and respect, Gandhari chose to blindfold herself permanently to share her future husband's affliction. Meanwhile, at a grand swayamvara hosted by Kuntibhoja, the beautiful and accomplished princess Kunti, after carefully surveying many kings, chose the valiant Pandu as her husband, thus marking the beginning of the next generation of Kuru rulers and securing the lineage's future.","[""Bhishma"", ""Dhritarashtra"", ""Pandu"", ""Gandhari"", ""Kunti""]","Duty, devotion, and dynastic future","Major life decisions, especially those impacting family and legacy, often involve personal sacrifice and a deep sense of duty. True devotion can manifest in profound acts of solidarity.",2026-03-14T10:09:31.060763+00:00,[],True
mahabharat,1,63,Sakuntala's Birth and Marriage to Dushmanta,Section LXXI | Section LXXII | Section LXXIII,"King Dushmanta, while hunting, arrives at Rishi Kanwa's hermitage and encounters the beautiful Sakuntala. Intrigued by her grace and ascetic appearance, he inquires about her parentage. Sakuntala reveals her extraordinary birth story: her biological father is the powerful sage Viswamitra, whose intense penances alarmed Indra. To break his austerities, Indra dispatched the celestial nymph Menaka. With the aid of the wind god Marut, Menaka successfully tempted Viswamitra, leading to their union and the birth of Sakuntala. Menaka abandoned the infant, who was then discovered and raised by Rishi Kanwa. Hearing this tale, Dushmanta, captivated by Sakuntala, proposes a Gandharva marriage, which she accepts, and they marry in the hermitage.","[""Dushmanta"", ""Sakuntala"", ""Kanwa"", ""Viswamitra"", ""Menaka"", ""Indra""]",Divine intervention and fated love,"Even the most disciplined individuals can be swayed by powerful desires, leading to unforeseen consequences and new beginnings.",2026-03-14T10:09:37.184681+00:00,[],True
mahabharat,1,64,Santanu and Ganga: The Birth of Devavrata,Section XCVIII | Section XCIX,"King Santanu falls deeply in love with a celestial maiden, Ganga, who agrees to marry him on one strict condition: he must never question her actions or speak unkindly, or she will leave. Santanu, smitten, agrees to her terms. Over time, Ganga gives birth to eight sons, but to Santanu's horror, she drowns the first seven in the river, each time stating it's ""for their good."" Though heartbroken, Santanu remains silent, bound by his promise. When the eighth child is born, and Ganga prepares to drown him too, Santanu can no longer bear it and breaks his vow, pleading with her to stop and questioning her motives. Ganga then reveals her true identity as the river goddess and explains that the children were the eight Vasus, cursed by Rishi Vasishtha to be born on Earth. Her purpose was to free them from their human forms. Having fulfilled her divine duty and with Santanu having broken his promise, Ganga leaves him, entrusting their eighth son, Devavrata, to his care.","[""Santanu"", ""Ganga"", ""Devavrata""]",Mysterious love and divine duty,"Promises, once made, carry significant weight and can have unforeseen consequences when broken, even with good intentions. Sometimes, what appears to be cruel or inexplicable behavior has a deeper, divine purpose that is only revealed in time.",2026-03-14T10:09:46.656581+00:00,[],True
mahabharat,1,65,Santanu's Desire and Devavrata's Inquiry,Section C,"King Santanu, a virtuous ruler, once observed the Ganga river's flow mysteriously checked. He discovered a handsome youth, his son Devavrata (born of Ganga), was responsible, using celestial weapons. Ganga then appeared, revealing Devavrata's identity and his extensive education under Vasishtha, making him skilled in all arts and weapons. Santanu, filled with joy, brought Devavrata to Hastinapura and installed him as heir-apparent, finding great happiness in his accomplished son. Four years later, while by the Yamuna, Santanu was captivated by a divine fragrance, leading him to a beautiful fisher maiden, Satyavati. Overwhelmed by desire, he approached her father to ask for her hand, setting the stage for a new complication.","[""Santanu"", ""Devavrata"", ""Ganga"", ""Satyavati""]",Paternal pride and burgeoning desire,"Even after finding great fulfillment and securing a legacy, new desires can arise unexpectedly, potentially challenging established plans or commitments.",2026-03-14T10:09:52.177446+00:00,[],True
mahabharat,1,66,Satyavati's Despair and Vyasa's Promise,Section CIII | Section CIV | Section CV,"Satyavati is consumed by grief after her son Vichitravirya dies childless, threatening the Kuru lineage. She implores Bhishma, her stepson, to marry Vichitravirya's widows, Ambika and Ambalika, and raise heirs to continue the royal line and ensure the ancestors' peace. However, Bhishma steadfastly refuses, reminding her of his solemn vow of celibacy, which he considers more sacred than any worldly duty or desire. He asserts that he would abandon everything before abandoning truth. Faced with Satyavati's continued distress, Bhishma suggests an ancient, permissible practice for such emergencies: Niyoga. He explains that a virtuous Brahmana could be appointed to raise offspring on the widows, citing historical precedents like the revival of the Kshatriya race after Parashurama's purges and the story of the sage Dirghatamas.","[""Satyavati"", ""Bhishma""]","Grief, duty, and unwavering vows","Sometimes, upholding a deeply held personal vow requires finding creative, ethical alternatives to fulfill other important responsibilities. True integrity lies in honoring commitments while seeking solutions that serve the greater good.",2026-03-14T10:10:01.576182+00:00,[],True
mahabharat,1,67,The Birth of Ghatotkacha,Section CLVII,"After Bhima slays the Rakshasa Hidimba, his sister Hidimva falls deeply in love with Bhima. Despite Bhima's initial reluctance and Yudhishthira's concern, Hidimva passionately pleads with Kunti and Yudhishthira for acceptance, promising to return Bhima to them daily and assist the Pandavas in their journeys. Yudhishthira, valuing virtue and compassion, agrees to her proposal, with the condition that Bhima returns each night. Bhima, in turn, agrees to stay with Hidimva until she bears a son. They spend time together in various beautiful locales, and soon, Hidimva gives birth to a powerful son, Ghatotkacha, who grows to adulthood instantly. Named for his pot-like head, Ghatotkacha promises to aid the Pandavas whenever called upon, before he and his mother depart.","[""Bhima"", ""Hidimva"", ""Yudhishthira"", ""Kunti"", ""Ghatotkacha""]",Unconventional love and acceptance,"Sometimes, unexpected alliances or relationships can arise from difficult circumstances, bringing forth unforeseen strength and support.",2026-03-14T10:10:07.890374+00:00,[],True
mahabharat,1,68,The Birth of Satyavati and Vyasa,Section LXIII,"King Uparichara, also known as Vasu, was a virtuous ruler of Chedi. After being convinced by the gods to return from asceticism, Indra gifted him a celestial car, an unfading garland, and established the annual Indra festival. Vasu's five sons founded various kingdoms. Later, a lustful mountain, Kolahala, attacked the river Suktimati. Vasu intervened, freeing the river, who then presented him with her twin children by the mountain: a son and a daughter named Girika, whom Vasu married. One spring day, after Girika's purification bath, Vasu was called by his ancestors for a hunting ritual. Overwhelmed by desire for Girika while hunting, he entrusted his semen to a hawk to deliver to her. However, during a fight between two hawks, the semen fell into the Yamuna river. It was then swallowed by Adrika, an Apsara cursed to live as a fish, setting the stage for the extraordinary birth of Satyavati and Vyasa.","[""Uparichara (Vasu)"", ""Indra"", ""Girika"", ""Adrika"", ""Satyavati"", ""Vyasa""]",Desire and destiny's unfolding,"Even well-intentioned actions or moments of human desire can have unforeseen, far-reaching consequences, often shaping destinies in ways we cannot predict. Life's path is often a complex interplay of personal choices and larger forces.",2026-03-14T10:10:16.521733+00:00,[],True
mahabharat,1,69,The Birth of the Kauravas and Vidura,Section CVI | Section CXV | Section CXVI | Section CXVII,"To continue the Kuru lineage, Satyavati arranges for her daughters-in-law, Ambika and Ambalika, to conceive with Vyasa. Ambika, terrified by Vyasa's appearance, closes her eyes, resulting in the birth of Dhritarashtra, who is blind. Ambalika, turning pale from fear, gives birth to Pandu, who has a pale complexion. When Ambika refuses a second encounter, she sends her maid, who respectfully serves Vyasa, leading to the birth of Vidura, a wise and virtuous son. Later, Dhritarashtra's wife, Gandhari, receives a boon from Vyasa for a hundred sons. After a prolonged pregnancy, she aborts a mass of flesh. Vyasa intervenes, dividing it into 101 parts, which mature in pots, becoming the hundred Kaurava sons and one daughter. Dhritarashtra also fathers another son with a Vaisya wife.","[""Satyavati"", ""Vyasa"", ""Ambika"", ""Ambalika"", ""Dhritarashtra"", ""Pandu"", ""Vidura"", ""Gandhari""]",Consequences of human reactions,"Our immediate reactions to challenging or unfamiliar circumstances can have profound and lasting consequences, shaping not only our own lives but also the destiny of others.",2026-03-14T10:10:23.893047+00:00,[],True
mahabharat,1,70,The Brahmana's Sacrifice,Section CLIX | Section CLX | Section CLXI,"The Pandavas, living in disguise in Ekachakra, reside in a Brahmana's house, subsisting on alms. One day, Kunti and Bhima hear heart-wrenching wails from their host's family. Kunti, moved by compassion and a sense of duty to repay their host's kindness, urges Bhima to investigate. Bhima readily agrees to help. They discover the Brahmana, his wife, son, and daughter in profound despair. The Brahmana reveals their town is terrorized by a Rakshasa named Baka, to whom one family member must be sacrificed. He agonizes over the impossible choice of sacrificing himself, his wife, or his children, fearing the devastating consequences for those left behind. His wife then bravely offers herself, asserting it is a wife's highest dharma to protect her husband and ensure the children's future.","[""Kunti"", ""Bhima"", ""The Brahmana"", ""The Brahmana's Wife""]",Despair and compassion,"When faced with an impossible choice, the instinct to protect loved ones can lead to profound self-sacrifice. Compassion for others can inspire us to act even when it seems daunting.",2026-03-14T10:10:31.258607+00:00,[],True
mahabharat,1,71,The Curse of Sringin and Parikshit's Demise,Section XLI | Section XLII | Section XLIII | Section XLIV,"King Parikshit, exhausted and frustrated during a hunt, encountered Sage Samika observing a vow of silence. When the sage didn't respond to his queries about a lost deer, Parikshit, in a moment of irritation, placed a dead snake on Samika's shoulder. Samika's young son, Sringin, upon learning of this disrespect, became enraged. Despite his father's silent forgiveness, Sringin, touching water, impulsively cursed King Parikshit to die within seven nights by the bite of the serpent king Takshaka. Sage Samika, though acknowledging his son's truthful speech, was deeply displeased by Sringin's rashness, emphasizing the importance of forgiveness towards rulers and the destructive nature of anger. Out of compassion, Samika sent his disciple, Gaurmukha, to warn Parikshit of the impending doom, leaving the king filled with sorrow and regret.","[""Parikshit"", ""Sringin"", ""Samika"", ""Gaurmukha""]",Impulsive anger and its repercussions,"Even when provoked, acting out of immediate anger can lead to irreversible consequences, harming not only others but also one's own peace and spiritual progress.",2026-03-14T10:10:39.488641+00:00,[],True
mahabharat,1,72,The Curses of Mahabhisha and the Vasus,Section XCVI | Section XCVII,"King Mahabhisha, while attending Brahma's assembly, rudely stares at Ganga, incurring Brahma's curse to be reborn on Earth. Ganga, also captivated, thinks of him. Separately, the celestial Vasus are cursed by Sage Vasishtha for unknowingly disrespecting him, compelling them to take human birth. The Vasus approach Ganga, asking her to be their human mother and to cast them into the river after birth to shorten their earthly stay, ensuring one son, formed from their combined energies, survives. They choose Santanu, son of King Pratipa, as their father. Later, Ganga approaches Pratipa, who, bound by his vows, suggests she marry his future son, Santanu, without questioning her actions. Santanu, now king, encounters Ganga by the river, setting the stage for their fated union.","[""Mahabhisha"", ""Ganga"", ""Vasus"", ""Pratipa"", ""Santanu""]",Destiny's intricate web,"Unintended actions can set in motion a chain of events that shape future lives and relationships. Sometimes, what appears to be a misfortune can be a necessary step towards a destined path.",2026-03-14T10:10:46.840041+00:00,[],True
mahabharat,1,73,The Early Kuru Succession,Section CI,"After marrying Satyavati, King Santanu fathered two sons: Chitrangada and Vichitravirya. Upon Santanu's passing, Bhishma, honoring Satyavati's wishes, installed the elder son, Chitrangada, on the Kuru throne. Chitrangada, a powerful warrior, quickly vanquished other monarchs, leading to a sense of invincibility. This hubris attracted the attention of a Gandharva king, also named Chitrangada, who challenged him. A fierce three-year battle ensued on the banks of the Saraswati, culminating in the Gandharva slaying the Kuru prince. Following Chitrangada's demise, Bhishma performed the funeral rites. He then installed the younger son, Vichitravirya, who was still a minor, as the new king, diligently guiding him in ruling the ancestral kingdom.","[""Santanu"", ""Satyavati"", ""Bhishma"", ""Chitrangada"", ""Vichitravirya""]",Unexpected loss and responsibility,"Even with great power, life's unpredictability can bring sudden loss. Those left behind must shoulder new responsibilities, often for the vulnerable.",2026-03-14T10:10:52.598436+00:00,[],True
mahabharat,1,74,The Great Narrative Begins: Vyasa and Vaisampayana,Section LIX | Section LX,"Saunaka, eager to hear more, requests Sauti to recite the Mahabharata, the great history composed by Vyasa. Sauti agrees, expressing his own pleasure in narrating it. The scene then shifts to King Janamejaya's snake sacrifice, where the revered Rishi Krishna-Dwaipayana Vyasa, grandfather of the Pandavas, arrives. Janamejaya, honoring his great-grandfather, welcomes Vyasa with immense respect. Curious about the epic conflict that led to the destruction of his ancestors, Janamejaya asks Vyasa to recount the history of the Kurus and Pandavas. Instead of narrating it himself, Vyasa instructs his disciple, Vaisampayana, who was present and had heard the entire history from Vyasa, to recite the full narrative to the king, the assembled priests, and chieftains. Thus, the grand tale of the Mahabharata begins its formal recitation.","[""Saunaka"", ""Sauti"", ""Vyasa"", ""Janamejaya"", ""Vaisampayana""]",Eager anticipation of a grand narrative,The desire to understand our past and the conflicts that shaped it can lead us to profound stories. Sharing these narratives ensures that important lessons and histories are preserved for future generations.,2026-03-14T10:10:59.265053+00:00,[],True
mahabharat,1,75,The Kuru Council and Founding of Indraprastha,CCI | CCII | CCIII | CCIV | CCV | CCVI | CCVII | CCVIII | CCIX,"Following Draupadi's Swayamvara, the Pandavas' identity is revealed, confirming their marriage to Draupadi. Kunti blesses her new daughter-in-law, and Krishna sends lavish gifts to the Pandavas, solidifying their status. News of their survival and alliance with King Drupada spreads, astonishing other monarchs who had believed them dead. Duryodhana and his brothers are filled with dismay and fear, lamenting their failed plot and the Pandavas' newfound strength and powerful allies. In contrast, Vidura rejoices, informing Dhritarashtra of the Pandavas' good fortune. Dhritarashtra initially expresses happiness, but Duryodhana and Karna quickly approach him, attempting to sow discord and prevent him from embracing the Pandavas' success, highlighting the deep-seated rivalry.","[""Pandavas"", ""Draupadi"", ""Kunti"", ""Krishna"", ""Duryodhana"", ""Vidura"", ""Dhritarashtra"", ""Karna""]",Reactions to a surprising return,"Unexpected turns of events can drastically alter perceptions and alliances, revealing true intentions and fears among those involved. The success of one group can evoke vastly different emotional responses, from joy to bitter despair, depending on their relationship.",2026-03-14T10:11:07.699421+00:00,[],True
mahabharat,1,76,The Lineage of Puru and Early Bharata Kings,Section XCIV | Section XCV,"Janamejaya asks Vaisampayana to recount the illustrious lineage of Puru. The narrative traces the succession through mighty kings like Pravira, Manasyu, and Anadhrishti, leading to Dushmanta and his son Bharata. Bharata, dissatisfied with his own sons, adopts Bhumanyu, ensuring the continuation of his line. Further down, King Samvarana faces a devastating period of famine, disease, and defeat by the Panchalas, forcing his people into a thousand-year exile in the Sindhu forest. Through the intervention and guidance of the revered Rishi Vasishtha, Samvarana is eventually able to reclaim his kingdom and restore the glory of his dynasty. The lineage continues through Kuru, who sanctifies Kurukshetra, and further down to kings like Parikshit and the ancestors of the current Janamejaya. This account highlights the enduring spirit and eventual triumph of the Puru dynasty.","[""Puru"", ""Bharata"", ""Samvarana"", ""Vasishtha"", ""Kuru""]",Dynastic resilience and restoration,"Even the most powerful lines face periods of severe adversity and exile, but with perseverance and the right guidance, it is possible to overcome challenges and reclaim one's legacy.",2026-03-14T10:11:14.424888+00:00,[],True
mahabharat,1,77,The Lineage of Puru and Yayati's Youth Exchange,Section LXXV,"The narrative traces a significant lineage, culminating in the powerful King Yayati. Afflicted by premature decrepitude due to a curse, Yayati, still desiring worldly pleasures, asks his five sons to exchange their youth for his old age. While his elder sons refuse, his youngest son, Puru, selflessly agrees to take on his father's infirmity. This allows Yayati to regain his youth and indulge in a thousand years of renewed vigor and enjoyment with his wives and an Apsara. However, Yayati eventually realizes that his desires remain unsatiated and only intensify with indulgence. Understanding this profound truth, he takes back his old age, returning Puru's youth, and prepares to seek peace through meditation.","[""Yayati"", ""Puru""]",The futility of endless desire,"True contentment is not found in endless pursuit of pleasure, as desires only grow with indulgence. Sometimes, a selfless act can lead to a deeper understanding for everyone involved.",2026-03-14T10:11:22.170940+00:00,[],True
mahabharat,1,78,The Rejection and Acceptance of Bharata,Section LXXIV,"After Dushmanta departed, Sakuntala gave birth to a son of immense energy. Raised in Kanwa's ashram, the boy, named Sarvadamana for his strength in subduing wild animals, grew rapidly. When he was six, Kanwa instructed Sakuntala to take him to Dushmanta to be recognized as heir. Upon reaching Hastinapura, Sakuntala presented her son and reminded Dushmanta of their secret union and his promises. However, Dushmanta, feigning ignorance, harshly rejected her, calling her a wicked woman. Deeply hurt and enraged, Sakuntala passionately defended her truth, reminding him of his own conscience and the divine witnesses to his actions. She emphasized the sacred bond of marriage and the significance of a son, warning him against denying his own flesh and blood.","[""Dushmanta"", ""Sakuntala"", ""Bharata"", ""Kanwa""]",Denial and righteous anger,"Denying one's past actions, especially those involving promises and family, can lead to profound emotional pain and moral degradation. Truth, even when inconvenient, eventually comes to light, often with significant consequences for those who try to conceal it.",2026-03-14T10:11:28.783497+00:00,[],True
mahabharat,1,79,The Rise of the Pandavas,Section CXLI,"After a year, Dhritarashtra, recognizing Yudhishthira's virtues, installed him as heir-apparent. Yudhishthira quickly overshadowed his father's deeds with his good conduct. Bhima trained extensively in mace and sword with Balarama, becoming incredibly strong. Arjuna, however, became the most celebrated, mastering all weapons. Drona declared him unparalleled and bestowed upon him the powerful Brahmasira weapon, extracting a promise that Arjuna would fight him in the future. Nakula became a skilled warrior, and Sahadeva learned morality. The Pandava brothers, particularly Arjuna and Bhima, then embarked on campaigns, conquering numerous kings like the Sauvira and Yavana, extending the Kuru kingdom, and amassing vast wealth. Witnessing their immense prowess and growing influence, King Dhritarashtra's feelings towards the Pandavas turned to envy and anxiety, causing him sleepless nights.","[""Dhritarashtra"", ""Yudhishthira"", ""Bhima"", ""Arjuna"", ""Drona"", ""Nakula"", ""Sahadeva""]",Rising power and growing envy,"Great achievements often draw both admiration and resentment. It's crucial to be aware of how your success impacts those around you, especially family, and to navigate these complex emotions wisely.",2026-03-14T10:11:34.910574+00:00,[],True
