book_slug,chapter_no,verse_no,ref,source_sections,brief_summary,key_characters,core_emotion,lesson_seed,created_at,validation_errors,is_valid
mahabharat,1,21,Pandu's Demise and Royal Departures,Adi Parva > Section CXXV | Adi Parva > Section CXXVI | Adi Parva > Section CXXVII | Adi Parva > Section CXXVIII,"In the enchanting spring forest, King Pandu, overcome by desire for his wife Madri, tragically forgets the Rishi's curse that forbade him from intimacy. Despite Madri's resistance, he succumbs to passion and dies instantly. A grief-stricken Madri explains to Kunti that Pandu was consumed by fate. Kunti wishes to join Pandu in death, but Madri insists, arguing that Pandu died in her embrace and she fears she cannot adequately raise Kunti's children. Madri then bravely ascends Pandu's funeral pyre, sacrificing herself. The Rishis, witnessing these events, decide to bring Kunti and the five young Pandavas, along with the bodies of Pandu and Madri, back to Hastinapura. The royal family and citizens gather, where an elder Rishi formally announces Pandu's demise and introduces his sons to the Kuru elders.","[""Pandu"", ""Madri"", ""Kunti"", ""Rishis"", ""Bhishma"", ""Dhritarashtra""]",Tragic passion and sacrifice,"Uncontrolled desires can have devastating, irreversible consequences. Sometimes, love and duty compel individuals to make the ultimate sacrifice for those they cherish.",2026-03-14T10:04:17.517169+00:00,[],True
mahabharat,1,22,The Origins of Kripa and Drona,Adi Parva > Section CXXVIII | Adi Parva > Section CXXIX | Adi Parva > Section CXXX | Adi Parva > Section CXXXI,"After King Pandu's demise, the Pandavas and Kauravas grew up together in Hastinapura. Young Bhima, possessing immense strength, often playfully overpowered and tormented Duryodhana and his brothers, fueling Duryodhana's jealousy and ambition. Consumed by malice, Duryodhana plotted to eliminate Bhima. He invited the Pandavas to a water-sport outing at Pramanakoti, where he secretly poisoned Bhima's food. Once Bhima fell unconscious, Duryodhana bound him and threw him into the Ganga. Bhima sank to the Naga kingdom, where thousands of venomous snakes bit him. Miraculously, the snake venom neutralized the poison in his system, reviving him. Bhima broke free, subdued the snakes, and was recognized by Aryaka, a relative of Kunti, and welcomed by Vasuki, the king of Nagas.","[""Bhima"", ""Duryodhana"", ""Vasuki"", ""Aryaka""]",Jealousy and miraculous survival,"Malice, fueled by envy, can drive individuals to extreme acts of treachery. However, even in the face of such danger, unexpected circumstances or connections can lead to miraculous survival.",2026-03-14T10:04:24.819934+00:00,[],True
mahabharat,1,23,Drona's Preceptorship and Ekalavya's Sacrifice,Adi Parva > Section CXXXII | Adi Parva > Section CXXXIII | Adi Parva > Section CXXXIV,"Drona, recalling a childhood promise, approaches King Drupada to rekindle their friendship and claim a share of his kingdom. However, Drupada, now powerful and arrogant, cruelly rejects Drona, mocking his poverty and asserting that friendship cannot exist between unequals. Humiliated and enraged, Drona vows revenge and travels to Hastinapura. There, he lives discreetly until he encounters the Kuru princes struggling to retrieve a lost ball from a well. Drona astonishingly demonstrates his unparalleled archery skills, first using blades of grass to retrieve the ball, then an arrow for a ring. Impressed, the princes report this feat to Bhishma, who immediately recognizes Drona and, understanding his intent to train the princes to defeat Drupada, appoints him as their preceptor.","[""Drona"", ""Drupada"", ""Kuru Princes"", ""Bhishma""]",Humiliation and Resolve,"Pride and changes in social status can severely strain or destroy even the deepest friendships. Disrespecting others, especially those you once shared a bond with, often leads to unforeseen and lasting consequences.",2026-03-14T10:04:31.957862+00:00,[],True
mahabharat,1,24,The Grand Tournament and Karna's Arrival,Adi Parva > Section CXXXV | Adi Parva > Section CXXXVI | Adi Parva > Section CXXXVII | Adi Parva > Section CXXXVIII,"Drona, recognizing Arjuna's unparalleled focus, tests him with a challenging target: shooting only the head of a bird. Arjuna's singular concentration impresses Drona, who later bestows upon him the powerful Brahmasira weapon after Arjuna swiftly rescues him from an alligator. With the princes' training complete, Drona arranges a grand public tournament to showcase their martial prowess. A magnificent arena is constructed, attracting a vast crowd including King Dhritarashtra, Bhishma, Kripa, Gandhari, and Kunti. The princes, led by Yudhishthira, demonstrate exceptional skill with bows, arrows, horses, and swords, captivating the audience. The display culminates with Bhima and Duryodhana entering the arena, mace in hand, setting the stage for further rivalry.","[""Drona"", ""Arjuna"", ""Dhritarashtra"", ""Bhishma"", ""Yudhishthira"", ""Bhima"", ""Duryodhana""]",Awe and anticipation,"Focused dedication to a craft can unlock extraordinary abilities and earn profound recognition. Public displays of skill, while celebrated, can also ignite underlying rivalries.",2026-03-14T10:04:40.010662+00:00,[],True
mahabharat,1,25,Drona's Revenge on Drupada,Adi Parva > Section CXL,"Drona, seeking retribution for a past insult, demands Drupada, the king of Panchala, as his preceptorial fee from his Kuru and Pandava pupils. Initially, Duryodhana and the Kuru princes attempt to capture Drupada but are fiercely repelled and forced to retreat. Observing their failure, Arjuna, accompanied by Bhima and his other Pandava brothers, takes charge. Bhima devastates Drupada's army, smashing elephants and chariots with his mace. Arjuna then confronts Drupada and his general, Satyajit, directly. Arjuna skillfully defeats Satyajit and then Drupada, cutting his bow and flag, ultimately capturing the Panchala king. The Pandavas then present the captive Drupada to Drona, fulfilling their preceptor's demand and securing his revenge.","[""Drona"", ""Drupada"", ""Arjuna"", ""Bhima""]",Revenge and triumph,"Holding onto past grievances can drive intense actions, but true skill and focused effort are often required to achieve difficult goals. Sometimes, a task requires a different approach or a more capable hand to succeed.",2026-03-14T10:04:46.449390+00:00,[],True
mahabharat,1,26,The Slaying of Vaka,Adi Parva > Section CLXI | Adi Parva > Section CLXII | Adi Parva > Section CLXIII | Adi Parva > Section CLXIV | Adi Parva > Section CLXV | Adi Parva > Section CLXVI,"A Brahmana family is consumed by grief as their turn arrives to provide a human sacrifice and food to the fearsome Rakshasa Vaka, who terrorizes their town. The distressed daughter bravely offers herself to save her parents and infant brother, while the young son innocently vows to fight Vaka with a blade of grass. Witnessing their profound sorrow, Kunti approaches and learns of their predicament: Vaka demands a human and provisions regularly, killing any family that refuses. Despite the Brahmana's refusal to let a guest or another Brahmana die for him, Kunti, moved by their plight, selflessly offers one of her own five sons to fulfill the Rakshasa's demand, presenting an unexpected solution to their desperate situation.","[""Brahmana"", ""Kunti"", ""Vaka""]",Despair and selfless resolve,"In moments of extreme crisis, unexpected acts of selflessness can emerge, offering hope and a path forward.",2026-03-14T10:04:54.016895+00:00,[],True
mahabharat,1,27,Draupadi's Birth and the Path to Panchala,Adi Parva > Section CLXVII | Adi Parva > Section CLXVIII | Adi Parva > Section CLXIX | Adi Parva > Section CLXX | Adi Parva > Section CLXXI,"The Pandavas, while residing in Ekachakra, learn from a traveling Brahmana about the extraordinary birth of Draupadi and Dhrishtadyumna from a sacrificial fire in Panchala. Intrigued, they request the full story. The Brahmana recounts the tale of Drona, born from a pot, and his childhood friendship with Drupada, the future king of Panchala. After Drupada ascended the throne, he arrogantly rejected Drona's friendship, citing their changed social status. Deeply insulted, Drona vowed revenge. He trained the Kuru princes, including the Pandavas, and as his guru-dakshina, demanded they capture Drupada and his kingdom. The Pandavas fulfilled this, bringing Drupada before Drona. Drona took half of Drupada's kingdom, establishing himself as an equal, and then offered friendship. Humiliated, Drupada, unable to defeat Drona with Kshatriya might, began a quest for a sacrifice to obtain powerful children who could avenge him, thus setting the stage for Draupadi's unique birth.","[""Drona"", ""Drupada"", ""Draupadi"", ""Dhrishtadyumna""]",Deep Humiliation and Vengeful Resolve,"Pride can sever even the strongest bonds, and the desire for revenge often leads to unforeseen and powerful consequences.",2026-03-14T10:05:02.782053+00:00,[],True
mahabharat,1,28,The Gandharva's Encounter and Ancient Lore,Adi Parva > Section CLXXII | Adi Parva > Section CLXXIII | Adi Parva > Section CLXXIV | Adi Parva > Section CLXXV | Adi Parva > Section CLXXVI | Adi Parva > Section CLXXVII | Adi Parva > Section CLXXVIII | Adi Parva > Section CLXXIX | Adi Parva > Section CLXXX,"The Pandavas, journeying towards Panchala with their mother, arrive at the sacred Ganga. There, they encounter Angaraparna, a proud Gandharva king, who is sporting in the river at twilight and forbids them from approaching, citing specific times for different beings. Arjuna challenges his arrogance, asserting the Ganga's universal accessibility. Enraged, Angaraparna attacks with arrows, but Arjuna, using a celestial fiery weapon, quickly defeats him, burning his chariot and dragging him unconscious. Angaraparna's wife, Kumbhinasi, pleads with Yudhishthira for her husband's life. Yudhishthira, demonstrating compassion, instructs Arjuna to spare him. Humbled, Angaraparna, now renamed, gratefully imparts the celestial knowledge of Chakshushi and a hundred Gandharva horses to the Pandavas, acknowledging their superior might and mercy.","[""Arjuna"", ""Yudhishthira"", ""Angaraparna"", ""Kumbhinasi""]",Humiliation and Grateful Exchange,"Even the proudest can be humbled by superior strength or virtue. Showing mercy to a defeated opponent can transform an adversary into a valuable ally, leading to unexpected gifts and knowledge.",2026-03-14T10:05:09.126796+00:00,[],True
mahabharat,1,29,Aurva's Vow and the Ocean Fire,Adi Parva > Section CLXXXI | Adi Parva > Section CLXXXII,"Aurva, born from his mother's thigh after she endured a century of carrying him during the extermination of the Bhrigu race by Kshatriyas, was filled with immense wrath. He initially scorched the eyes of princes who had offended his mother. After regaining their sight, Aurva vowed to destroy the entire world to avenge his ancestors. His Pitris (ancestors) appeared, urging him to desist, explaining that they had orchestrated their own demise through the Kshatriyas to achieve liberation, not out of weakness. Aurva, unwilling to let his vow go unfulfilled, argued that his repressed anger would consume him and that he had a duty to punish injustice. Seeking a way to honor his vow without destroying creation, he consulted his Pitris. They advised him to cast the fire of his wrath into the ocean. Aurva complied, transforming his destructive rage into the Vadavamukha, a submarine fire that continually consumes the ocean's waters, thus fulfilling his vow and preserving the worlds.","[""Aurva"", ""Pitris""]",Vengeful wrath and its redirection,"When consumed by powerful emotions like vengeance, seeking wise counsel can help find a constructive outlet, preventing harm to oneself and the world.",2026-03-14T10:05:17.871046+00:00,[],True
mahabharat,1,30,Parasara's Vengeful Sacrifice,Adi Parva > Section CLXXXIII,"Grief-stricken and enraged by the death of his father, Saktri, the sage Parasara initiated a grand Rakshasa sacrifice, intending to annihilate the entire race. He believed the Rakshasas were responsible for Saktri's demise and began consuming them in the sacrificial fires. His grandfather, Vasishtha, initially allowed this act of vengeance. However, as the sacrifice intensified, other revered Rishis like Atri, Pulastya, Pulaha, and Kratu arrived, concerned by the widespread destruction of innocent beings. Pulastya eloquently intervened, explaining to Parasara that Saktri's death was a consequence of his own curse, not solely the fault of the Rakshasas, and that such indiscriminate slaughter was not the path of a Brahmana. Convinced by Pulastya's wisdom and Vasishtha's counsel, Parasara eventually ceased the sacrifice, casting the remaining fire into the northern woods of the Himavat, where it continues to burn.","[""Parasara"", ""Vasishtha"", ""Pulastya"", ""Saktri""]",Vengeful rage appeased,Unchecked anger can lead to destructive actions against the innocent. Listening to wise counsel can help us understand the true nature of events and choose a path of peace over vengeance.,2026-03-14T10:05:24.497478+00:00,[],True
mahabharat,1,31,Kalmashapada's Curse and Vasishtha's Appointment,Adi Parva > Section CLXXXIV,"King Kalmashapada, still under the curse that made him a man-eater, wandered the forest with his queen. Overcome by hunger, he encountered a Brahmana and his wife. Despite the Brahmani's desperate pleas and warnings about his royal dharma, Kalmashapada cruelly devoured her husband. Enraged and heartbroken, the Brahmani cursed the king: he would die instantly if he approached his wife during her season. She further prophesied that his wife would bear a son through Rishi Vasishtha, whose own children Kalmashapada had previously consumed. The Brahmani then immolated herself. Years later, freed from the initial curse, Kalmashapada approached his wife, Madayanati, who reminded him of the Brahmani's curse. Fearing death and needing an heir, the king appointed Vasishtha to beget a son upon his queen.","[""Kalmashapada"", ""Brahmani"", ""Vasishtha"", ""Madayanati""]",Tragic consequence and desperate hope,"Uncontrolled actions, especially when influenced by a curse or strong emotions, can lead to devastating and long-lasting consequences. Sometimes, desperate situations require unconventional solutions to preserve a legacy.",2026-03-14T10:05:35.058682+00:00,[],True
mahabharat,1,32,Dhaumya Becomes Pandavas' Priest,Adi Parva > Section CLXXXV,"After their encounter with the Gandharva Chaitraratha, Arjuna seeks guidance on finding a suitable priest for the Pandavas. The Gandharva recommends Dhaumya, the younger brother of Devala, who is performing penances at the Utkochaka shrine. Pleased, Arjuna exchanges gifts with the Gandharva before the Pandavas, along with their mother Kunti, proceed to Utkochaka. There, they respectfully approach Dhaumya, who, after receiving them with wild fruits and roots, agrees to become their priest and spiritual preceptor. With Dhaumya, a master of the Vedas and morality, by their side, the Pandavas feel a renewed sense of hope and confidence, believing their sovereignty and the hand of the Panchala princess are within reach. They then resolve to journey to the Swayamvara.","[""Arjuna"", ""Dhaumya"", ""Kunti"", ""Gandharva Chaitraratha""]",Renewed hope and confidence,"Seeking wise counsel and spiritual guidance can provide a sense of direction and strength, even when facing daunting challenges. A good mentor can help you feel more capable of achieving your goals.",2026-03-14T10:05:42.052172+00:00,[],True
mahabharat,1,33,Draupadi's Swayamvara and Arjuna's Triumph,Adi Parva > Section CLXXXVI | Adi Parva > Section CLXXXVII | Adi Parva > Section CLXXXVIII | Adi Parva > Section CLXXXIX | Adi Parva > Section CLXL | Adi Parva > Section CLXLI | Adi Parva > Section CLXLII,"The Pandavas, disguised as Brahmins, journey with their mother Kunti towards Panchala. Along the way, they encounter other Brahmins who inform them about the grand Swayamvara being held by King Drupada for his beautiful daughter, Draupadi. Drupada has set a unique and difficult challenge: whoever can string a powerful bow and shoot a specific target through a rotating machine will win Draupadi's hand. Unbeknownst to others, Drupada secretly hopes Arjuna will be the one to accomplish this feat. Kings, princes, and many others gather from various lands to witness and participate in the elaborate festivities. The Pandavas, maintaining their disguise, take seats among the Brahmins in the magnificent amphitheater, observing the grand preparations as Draupadi finally enters the arena.","[""Arjuna"", ""Draupadi"", ""Drupada"", ""Yudhishthira""]",Intense anticipation,"Sometimes, opportunities arise in unexpected forms or disguises. Remaining observant and open to new paths can lead to significant life changes.",2026-03-14T10:05:52.844090+00:00,[],True
mahabharat,1,34,Draupadi's Quintuple Marriage and Divine Revelation,Adi Parva > Section CLXLIII | Adi Parva > Section CLXLIV | Adi Parva > Section CLXLV | Adi Parva > Section CLXLVI | Adi Parva > Section CLXLVII | Adi Parva > Section CLXLVIII | Adi Parva > Section CLXLIX | Adi Parva > Section CC,"After Arjuna wins Draupadi at her Swayamvara, the Pandavas return to their potter's abode. Kunti, unaware of what they brought, accidentally instructs her sons to ""enjoy what they have obtained"" collectively. This creates a moral dilemma and internal conflict among the brothers, as all are captivated by Draupadi's beauty. Yudhishthira, recalling a prophecy and fearing division, declares that Draupadi shall be the common wife of all five brothers. Shortly after, Krishna and Balarama arrive, recognizing the disguised Pandavas despite their efforts to remain hidden, and express their relief at their survival from the lacquer house fire. Meanwhile, Dhrishtadyumna, having secretly followed the Pandavas, observes their living situation and conversation, then reports these surprising developments to his father, King Drupada, who was previously unaware of his daughter's suitors' true identities.","[""Kunti"", ""Yudhishthira"", ""Arjuna"", ""Draupadi"", ""Krishna"", ""Dhrishtadyumna""]",Unexpected Destiny and Family Unity,"Sometimes, unforeseen circumstances and accidental words can lead to profound and unexpected life paths, requiring wisdom and sacrifice to maintain harmony. Prioritizing family unity can guide difficult decisions.",2026-03-14T10:05:58.829045+00:00,[],True
mahabharat,1,35,Subhadra's Abduction and Marriage,Adi Parva > Section CCXXI | Adi Parva > Section CCXXII | Adi Parva > Section CCXXIII,"Arjuna, while attending a grand festival of the Vrishnis and Andhakas on Raivataka mountain, becomes smitten with Subhadra, Krishna's beautiful sister. Krishna, observing Arjuna's interest, suggests that a forcible abduction is an honorable method of marriage for Kshatriyas, as a self-choice might be uncertain. Arjuna agrees, and with Yudhishthira's prior assent, he prepares for the act. As Subhadra returns from worshipping at the hill, Arjuna, in his magnificent chariot, swiftly abducts her and heads towards Indraprastha. Her attendants raise the alarm, causing uproar among the Vrishni and Andhaka heroes. They furiously prepare to pursue Arjuna, but Balarama, puzzled by Krishna's silence, urges them to first understand Krishna's intentions before acting rashly.","[""Arjuna"", ""Krishna"", ""Subhadra"", ""Balarama""]",Strategic love and calculated risk,"Sometimes, achieving a desired outcome requires unconventional methods and careful planning, even if it initially causes confusion or anger among others. Trusting the wisdom of a close confidant can prevent rash decisions.",2026-03-14T10:06:04.746851+00:00,[],True
mahabharat,1,36,Agni's Plea and the Divine Weapons,Adi Parva > Section CCXXIV | Adi Parva > Section CCXXV | Adi Parva > Section CCXXVI | Adi Parva > Section CCXXVII,"After settling happily in Indraprastha, the Pandavas enjoy a period of peace. Arjuna and Krishna decide to spend a day of recreation by the Yamuna river with friends, indulging in festivities and merriment. While resting, a radiant Brahmana approaches them. The Brahmana reveals himself to be Agni, the fire god, who is famished. Agni explains his long-standing desire to consume the Khandava forest, which he considers his ideal food. However, Indra, the king of gods, constantly protects the forest for his friend Takshaka, a powerful Naga, and other inhabitants, by sending torrential rains whenever Agni attempts to burn it. Agni, recognizing Arjuna and Krishna's prowess, implores them to assist him by preventing Indra's interference and ensuring no creatures escape, so he can finally satisfy his hunger.","[""Arjuna"", ""Krishna"", ""Agni""]",Divine hunger and plea for aid,Even powerful beings encounter insurmountable obstacles and must seek help from others. Recognizing one's limitations and asking for assistance can be the only path to achieving a long-held desire.,2026-03-14T10:06:11.997318+00:00,[],True
mahabharat,1,37,The Burning of Khandava and Mandapala's Tale,Adi Parva > Section CCXXVIII | Adi Parva > Section CCXXIX | Adi Parva > Section CCXXX | Adi Parva > Section CCXXXI | Adi Parva > Section CCXXXII | Adi Parva > Section CCXXXIII | Adi Parva > Section CCXXXIV | Adi Parva > Section CCXXXV | Adi Parva > Section CCXXXVI,"Krishna and Arjuna, empowered by Agni, began the devastating burning of the Khandava forest. They relentlessly prevented any creature from escaping, with Arjuna's arrows felling birds and animals attempting to flee. The intense heat and smoke caused immense suffering and death among the forest's inhabitants. Witnessing the widespread destruction, Indra, the king of gods, intervened by showering heavy rain to extinguish the fire. However, Arjuna, with his divine weapons, countered Indra's downpour, creating an impenetrable canopy of arrows that dried up the rain and kept the flames raging. During this fierce conflict, Aswasena, Takshaka's son, narrowly escaped thanks to his mother's sacrifice and Indra's momentary distraction of Arjuna. Enraged by the deception, Arjuna and Krishna continued their relentless assault, defeating other celestial beings and demons who attempted to protect the forest, ensuring Agni's complete consumption of Khandava.","[""Krishna"", ""Arjuna"", ""Agni"", ""Indra"", ""Aswasena""]",Relentless determination and divine conflict,"When pursuing a grand objective, one must be prepared for fierce opposition and the difficult choices involved. The story highlights the intense resolve needed to overcome obstacles, even when it means confronting powerful forces.",2026-03-14T10:06:19.942317+00:00,[],True
mahabharat,1,38,Arjuna's Exile and Adventures,CCXV | CCXVI | CCXVII | CCXVIII | CCXIX | CCXX | CCXXI,"Arjuna, upholding the Pandavas' pact regarding Draupadi, chose self-imposed exile. A Brahmana's cattle were stolen, and Arjuna needed his weapons, which were in a chamber where Yudhishthira and Draupadi were present. Though Yudhishthira argued that a younger brother entering an elder's chamber with his wife was not a violation, Arjuna, valuing truth and his vow above all, insisted on observing the agreed-upon consequence. He retrieved his bow, recovered the Brahmana's cattle, and then departed for a twelve-year forest exile. During his journey, accompanied by Brahmanas, he explored various regions, including the source of the Ganges. While performing ablutions there, he was unexpectedly pulled into the water by Ulupi, the Naga princess, marking the beginning of his adventures in exile.","[""Arjuna"", ""Yudhishthira"", ""Draupadi"", ""Brahmana"", ""Ulupi""]",Upholding a vow,"Sometimes, personal integrity and adherence to one's word require difficult sacrifices, even when others might offer an easier path. True commitment means honoring agreements regardless of convenience.",2026-03-14T10:06:25.110402+00:00,[],True
mahabharat,1,39,Astika Saves the Snakes and Ends the Sacrifice,Section LIII | Section LIV | Section LV | Section LVI | Section LVII | Section LVIII,"King Janamejaya's snake sacrifice intensifies, with countless serpents perishing in the sacrificial fire, causing immense suffering and a terrible stench. Takshaka, the target of the sacrifice, finds refuge with Indra, who assures him of safety due to a divine intervention. Overwhelmed with grief, Vasuki, the king of snakes, witnesses his lineage's near annihilation. He recalls an ancient prophecy from Brahma and appeals to his sister, Jaratkaru, to remind her son, Astika, of his destined role. Jaratkaru recounts Kadru's curse on the snakes and Brahma's words that her son would be their savior. Astika, a young and wise Brahmana, understands his purpose and reassures Vasuki, promising to intervene and halt the devastating sacrifice. He then proceeds to Janamejaya's sacrificial ground, determined to fulfill his prophecy.","[""Janamejaya"", ""Vasuki"", ""Jaratkaru"", ""Astika""]",Desperation and Prophetic Hope,"Even in the direst circumstances, hope can emerge from unexpected sources. Fulfilling a destined role, often guided by ancient wisdom, can bring salvation and avert catastrophe.",2026-03-14T10:06:33.346439+00:00,[],True
