book_slug,chapter_no,verse_no,ref,source_sections,brief_summary,key_characters,core_emotion,lesson_seed,created_at,validation_errors,is_valid
mahabharat,1,1,The Genesis of the Mahabharata,Adi Parva > Section I,"Sauti, son of Lomaharshana, arrives at the Naimisha forest where sages, led by Saunaka, are performing a twelve-year sacrifice. Having recently heard the Mahabharata recited by Vaisampayana at King Janamejaya's snake-sacrifice, Sauti is welcomed and respectfully questioned about his travels. The sages, eager for profound narratives, specifically request him to recount the sacred history of the Bharata, composed by the revered sage Vyasa. Sauti agrees, acknowledging the epic's vastness, its divine origins, and its comprehensive wisdom encompassing creation, dharma, artha, and kama. This encounter marks the beginning of Sauti's narration of the Mahabharata to the assembled sages, setting the stage for the epic's transmission to a wider audience.","[""Sauti"", ""Saunaka"", ""Vyasa"", ""Vaisampayana""]",Anticipation of profound wisdom,Great stories connect generations and transmit wisdom across time. Seeking out and sharing profound narratives enriches our understanding of life and its complexities.,2026-03-14T10:01:39.083272+00:00,[],True
mahabharat,1,2,Samanta-panchaka and the Epic's Outline,Adi Parva > Section II,"Sauti explains to the Rishis the significance of Samanta-panchaka, a sacred region. In the Treta-Dwapara Yuga interval, Parashurama, enraged by Kshatriya injustices, annihilated them, forming five lakes of blood. His ancestors, pleased by his devotion, granted him absolution from his violent acts and sanctified the lakes. This same holy ground, Samanta-panchaka, later became the site of the devastating Kurukshetra War between the Kauravas and Pandavas, where eighteen Akshauhinis of soldiers perished. Sauti then details the composition of an Akshauhini and provides a brief overview of the war's duration and key fighters. He concludes by outlining the initial parvas of the Mahabharata, emphasizing its profound wisdom and comprehensive nature as a foundational text.","[""Sauti"", ""Rishis"", ""Parashurama"", ""Pitris""]",Consequences of extreme anger and absolution,"Extreme anger can lead to widespread destruction, but seeking forgiveness and making amends can bring peace and sanctity to even the most violent acts.",2026-03-14T10:01:47.153478+00:00,[],True
mahabharat,1,3,Sarama's Curse and Janamejaya's Purohita,Adi Parva > Section III,"Janamejaya and his brothers were performing a long sacrifice when Sarama's son, a celestial dog, arrived. Janamejaya's brothers beat the innocent pup, causing it to cry to its mother. Enraged by her son's unjust suffering, Sarama appeared before Janamejaya and cursed them, declaring that evil would befall them unexpectedly for their cruel act. Deeply alarmed by the curse, Janamejaya concluded his sacrifice and returned to Hastinapura, determined to find a Purohita who could absolve his sin and neutralize the curse's effects. During a hunt, he discovered Rishi Srutasrava, whose son, Somasrava, was born of a she-snake and possessed immense ascetic power. Somasrava, capable of absolving all sins except those against Mahadeva, had one condition: he would grant any request from a Brahmana. Janamejaya accepted him as his spiritual master, instructing his brothers to obey Somasrava implicitly, before embarking on a conquest of Takshyashila.","[""Janamejaya"", ""Sarama"", ""Somasrava"", ""Srutasrava""]",Fear of karmic retribution,"Unjust actions, even against the seemingly powerless, can lead to unforeseen consequences. Seeking spiritual guidance can help navigate the repercussions of one's misdeeds.",2026-03-14T10:01:53.867716+00:00,[],True
mahabharat,1,4,The Bhrigu Lineage and Agni's Purification,Adi Parva > Section IV | Adi Parva > Section V | Adi Parva > Section VI | Adi Parva > Section VII,"Saunaka requests Sauti to narrate the lineage of Bhrigu, beginning with Bhrigu, born from Varuna's sacrifice. The story focuses on Bhrigu's pregnant wife, Puloma. While Bhrigu is away, a Rakshasa also named Puloma, who had previously been betrothed to the lady, enters the hermitage. Overcome with desire, the Rakshasa questions Agni, the sacrificial fire, about the true husband of Puloma, claiming her as his first choice. Agni, caught between the fear of lying and Bhrigu's curse, reluctantly confirms that while the Rakshasa chose her first, Bhrigu married her with proper Vedic rites. Enraged, the Rakshasa transforms into a boar and abducts Puloma. The child in her womb, enraged by the violence, drops out, earning the name Chyavana. Upon seeing the radiant infant, the Rakshasa falls, turning instantly into ashes. A distraught Puloma then takes her child.","[""Bhrigu"", ""Puloma"", ""Chyavana"", ""Agni"", ""Rakshasa Puloma""]",Truth's difficult burden and its consequences,"Speaking truth can be fraught with difficulty, especially when it involves past wrongs or powerful figures. Unresolved grievances, when acted upon violently, often lead to self-destruction.",2026-03-14T10:02:04.728924+00:00,[],True
mahabharat,1,5,Ruru's Vow and Sahasrapat's Redemption,Adi Parva > Section VIII | Adi Parva > Section IX | Adi Parva > Section X | Adi Parva > Section XI | Adi Parva > Section XII,"Ruru, son of Pramati, fell deeply in love with Pramadvara, an Apsara's daughter raised by Rishi Sthulakesa. Their wedding was arranged, but tragedy struck when Pramadvara, playing near the hermitage, was fatally bitten by a snake. Overwhelmed with grief, Ruru retreated to the forest, lamenting her loss and praying for her revival. A celestial messenger appeared, explaining that Pramadvara's life had ended, but offered a divine solution: Ruru could restore her by sacrificing half of his own lifespan. Without hesitation, Ruru agreed. The celestial messenger and Pramadvara's father then sought the approval of Dharma, the god of justice, who sanctioned the transfer. Pramadvara awoke as if from a deep sleep, endowed with half of Ruru's life. They married and lived devotedly. However, Ruru, still consumed by the trauma of his wife's death, vowed to kill every snake he encountered. This vow led him to confront an old Dundubha snake, which he intended to slay, despite its plea of innocence.","[""Ruru"", ""Pramadvara"", ""Sthulakesa"", ""Celestial Messenger"", ""Dharma"", ""Dundubha""]",Devotion and vengeful resolve,Extreme grief can lead to vows of vengeance that may cause harm to the innocent. It's important to process loss without letting anger dictate future actions.,2026-03-14T10:02:11.918757+00:00,[],True
mahabharat,1,6,Jaratkaru's Ancestors and Astika's Prophecy,Adi Parva > Section XIII | Adi Parva > Section XIV | Adi Parva > Section XV,"Rishi Jaratkaru, a powerful ascetic, discovers his ancestors suspended in a pit, suffering due to his lack of offspring. They explain that without a son, their lineage will end, preventing their ascent to higher realms. Moved by their plight, Jaratkaru agrees to marry and procreate, but sets unusual conditions: his bride must share his name and be offered as charity. After searching, he encounters Vasuki, the king of the Nagas, who offers his sister, also named Jaratkaru, fulfilling the Rishi's condition. Jaratkaru marries her, and they have a son named Astika. This union was crucial because the Nagas were under a curse to be destroyed in Janamejaya's future snake sacrifice. Astika, born from this union, is destined to save them. Jaratkaru, having fulfilled his ancestral duty, eventually ascends to heaven, leaving Astika to fulfill his destiny.","[""Jaratkaru"", ""Jaratkaru's Ancestors"", ""Vasuki"", ""Astika""]",Fulfilling ancestral duty,"Sometimes, personal sacrifices are necessary to fulfill obligations to family or community. Our actions have far-reaching consequences, impacting not just ourselves but also our ancestors and future generations.",2026-03-14T10:02:23.049678+00:00,[],True
mahabharat,1,7,"Kadru, Vinata, and the Birth of Garuda",Adi Parva > Section XVI,"Kasyapa, a revered sage, had two wives, Kadru and Vinata, both of whom he granted a boon. Kadru wished for a thousand powerful snake sons, while Vinata desired two sons superior to Kadru's in strength and prowess. Both wives laid eggs, which Kasyapa instructed them to nurture. After 500 years, Kadru's eggs hatched, producing a multitude of snakes. Impatient and jealous that her eggs hadn't hatched, Vinata prematurely broke one. From it emerged Aruna, partially developed, who cursed his mother to servitude for her impatience but promised deliverance by her second son if she waited. Aruna then ascended to become the sun god Surya's charioteer. True to the prophecy, after another 500 years, Vinata's second egg hatched, revealing the mighty Garuda, destined to be the king of birds and the eater of serpents, who then departed.","[""Kadru"", ""Vinata"", ""Kasyapa"", ""Aruna"", ""Garuda""]",Impatience and its consequences,"Acting out of impatience can lead to unforeseen negative consequences and even servitude. Sometimes, waiting with faith and patience allows for the natural unfolding of greater outcomes.",2026-03-14T10:02:30.676057+00:00,[],True
mahabharat,1,8,The Churning of the Ocean for Amrita,Adi Parva > Section XVII | Adi Parva > Section XVIII | Adi Parva > Section XIX,"The gods, desiring immortality, sought the help of the Asuras to churn the cosmic ocean for Amrita. They used Mount Mandara as a churning rod, supported by the Tortoise-king Kurma, and the great serpent Vasuki as the churning rope. During this arduous process, Vasuki emitted a deadly poison, Kalakuta, which threatened all creation until Lord Shiva swallowed it, turning his throat blue. As the churning continued, various divine treasures emerged, including the celestial horse Uchchaihsravas, the goddess Lakshmi, the moon Soma, and finally, Dhanwantari bearing the pot of Amrita. The Asuras immediately seized the nectar, but Lord Vishnu, assuming the enchanting form of Mohini, cleverly tricked them and distributed the Amrita to the gods, securing their immortality.","[""Vishnu"", ""Shiva"", ""Brahman"", ""Gods"", ""Asuras"", ""Vasuki"", ""Kurma""]",Desperate pursuit of immortality,"Achieving a great goal often requires immense collective effort and facing unexpected dangers. Sometimes, clever strategy and even deception are employed when stakes are high and adversaries are formidable.",2026-03-14T10:02:40.430790+00:00,[],True
mahabharat,1,9,The Snake Curse and the Foretelling of the Sacrifice,Adi Parva > Section XX,"Kadru and Vinata, sisters and co-wives, made a wager about the color of the divine horse Uchchaishravas's tail. Kadru claimed it was black, while Vinata insisted it was white. The loser would become the other's slave. Desperate to win, Kadru commanded her thousand snake sons to transform into black hairs and cover the horse's tail. When her sons refused, Kadru, enraged, cursed them to be consumed by fire in the snake-sacrifice of King Janamejaya. The Grandsire Brahman, along with the other gods, overheard this potent curse. Recognizing the snakes' inherently venomous and destructive nature, and their threat to all creatures, Brahman sanctioned Kadru's curse, deeming it necessary for the welfare of the world. He then comforted Kasyapa, the snakes' father, revealing that their destruction was long foretold and imparting knowledge to neutralize poison.","[""Kadru"", ""Vinata"", ""Brahman"", ""Kasyapa"", ""The Snakes""]",Deception's dire consequences,"Actions driven by deceit or anger can have far-reaching and unintended consequences, sometimes even leading to a greater good as determined by fate.",2026-03-14T10:02:47.989899+00:00,[],True
mahabharat,1,10,The Wager and Garuda's Birth,Adi Parva > Section XXI | Adi Parva > Section XXII | Adi Parva > Section XXIII,"Kadru and Vinata, co-wives and sisters, made a fateful wager concerning the color of the divine horse Uchchaishravas's tail. Kadru, claiming it was black, secretly instructed her Naga sons to cling to the horse's tail, making it appear dark. Fearing their mother's curse, the Nagas complied. After journeying across the vast ocean, the sisters inspected the horse. Seeing the tail covered in black, Vinata lost the wager and was forced into slavery by Kadru. Soon after, Vinata's son, Garuda, burst forth from his egg with incredible splendor, radiating such intense light that the gods initially mistook him for a raging fire. Agni clarified that this powerful, radiant being was indeed Garuda, born to bring joy to Vinata and destined to be the destroyer of the Nagas.","[""Kadru"", ""Vinata"", ""Nagas"", ""Garuda""]",Deception and destiny,"Deception, even when seemingly successful, often leads to unforeseen consequences and the rise of new forces. The actions of one generation can profoundly shape the destiny of the next.",2026-03-14T10:02:55.614718+00:00,[],True
mahabharat,1,11,Aruna Becomes Surya's Charioteer,Adi Parva > Section XXIV | Adi Parva > Section XXV | Adi Parva > Section XXVI,"Surya, the Sun god, became enraged after Rahu, exposed by Surya and Soma during the churning of the ocean, developed a lasting enmity towards him. Feeling unsupported by the other gods who witnessed his plight, Surya resolved to burn the worlds with his intense rays. As he began radiating destructive heat even before dawn, causing widespread panic among gods and Rishis, they appealed to Brahma. The Grandsire revealed that he had already foreseen this crisis and provided a solution: Aruna, the powerful son of Kashyapa, would serve as Surya's charioteer. Aruna, immense and splendid, would position himself in front of Surya, absorbing his fierce energy and preventing the world's destruction. Thus, Aruna took his place, and Surya rose, his destructive power veiled, ensuring the welfare of all beings.","[""Surya"", ""Aruna"", ""Brahma"", ""Rahu""]",Divine intervention and crisis averted,"Even in moments of overwhelming anger or perceived injustice, a higher plan or unseen support can emerge to prevent catastrophe and restore balance. Sometimes, solutions appear from unexpected sources.",2026-03-14T10:03:01.601157+00:00,[],True
mahabharat,1,12,Garuda's Quest for Amrita and First Feats,Adi Parva > Section XXVII | Adi Parva > Section XXVIII | Adi Parva > Section XXIX,"Garuda discovers his mother, Vinata, is enslaved by the Nagas due to a deceptive bet. To free her, he must retrieve Amrita. Before his quest, he asks Vinata for food. She directs him to consume Nishadas but sternly warns him against harming any Brahmana, describing how a Brahmana would burn him or be indigestible. Garuda flies to the Nishada settlement, creating a massive dust storm and swallowing countless inhabitants. Inside, a Brahmana and his Nishada wife cause a burning sensation in his throat. Recognizing the Brahmana, Garuda opens his mouth, allowing them to escape unharmed. He then meets his father, Kasyapa, and reaffirms his unwavering resolve to obtain Amrita and liberate his mother.","[""Garuda"", ""Vinata"", ""Nagas"", ""Brahmana""]",Filial devotion and initial trials,"Even when driven by a powerful desire for liberation, upholding ethical principles and showing discernment are crucial. True strength includes the wisdom to protect the vulnerable.",2026-03-14T10:03:08.946053+00:00,[],True
mahabharat,1,13,Garuda's Divine Origin and Unstoppable Power,Adi Parva > Section XXX | Adi Parva > Section XXXI,"Garuda, a being of immense power born to Kasyapa and Vinata, embarks on a quest to acquire the divine Soma to free his enslaved mother. During his journey, he encounters a colossal tree branch supporting Valakhilya Rishis engaged in penance. To prevent harming them, Garuda astonishingly carries the branch, along with an elephant and a tortoise, in his claws and beak. His father, Kasyapa, helps by persuading the Rishis to relocate. Garuda then drops the massive branch on a remote mountain, causing widespread devastation, before consuming his prey. His unstoppable might and the ominous signs he generates deeply alarm the gods. Vrihaspati reveals to Indra that Garuda's arrival to seize the Soma is a direct consequence of Indra's past negligence and the Rishis' powerful penance. The gods, recognizing the threat, prepare for a formidable battle to protect the Amrita.","[""Garuda"", ""Kasyapa"", ""Indra"", ""Vrihaspati"", ""Valakhilya Rishis""]",Awe and apprehension of immense power,"Even the most powerful beings must navigate ethical dilemmas and consider the impact of their actions on others, while past actions can have unforeseen, powerful consequences.",2026-03-14T10:03:15.699715+00:00,[],True
mahabharat,1,14,The Battle for Amrita and Vinata's Freedom,Adi Parva > Section XXXII | Adi Parva > Section XXXIII | Adi Parva > Section XXXIV,"Garuda, driven by his mother Vinata's servitude, embarks on a perilous quest to retrieve the Amrita from the gods. He confronts the celestial guardians, creating a blinding dust storm and fiercely battling them with his immense power, forcing many gods to retreat. He then overcomes a formidable ring of fire by drinking vast amounts of river water and extinguishes it. Next, he navigates a razor-sharp spinning steel wheel and defeats two venomous, fire-breathing snakes guarding the Amrita. Taking the divine nectar without consuming it himself, Garuda encounters Vishnu, who, impressed by his self-denial, grants him immortality and the honor of being his mount and emblem. Indra then attacks Garuda, but Garuda, unharmed, shows respect and demonstrates his power, leading to a pact of friendship.","[""Garuda"", ""Vinata"", ""Vishnu"", ""Indra""]",Unwavering Determination for Freedom,"Even when facing overwhelming odds, unwavering determination and self-control can lead to extraordinary achievements and unexpected alliances. True strength lies not just in power, but also in self-denial and respect.",2026-03-14T10:03:23.412440+00:00,[],True
mahabharat,1,15,Sesha Supports the Earth,Adi Parva > Section XXXV | Adi Parva > Section XXXVI,"Sesha, the eldest Naga, was deeply troubled by the wicked nature and constant jealousy of his brothers, particularly their animosity towards Vinata and her son, Garuda. Disgusted, he left his mother and undertook severe penances in various sacred locations, enduring extreme austerities to escape their company. Lord Brahma, observing Sesha's profound devotion, inquired about his desire. Sesha expressed his wish to avoid his brothers and even shed his body to escape their association. Pleased with Sesha's virtue and self-denial, Brahma offered him a boon. Sesha asked for his heart to always delight in virtue and asceticism. Brahma then entrusted Sesha with a crucial task: to bear the unsteady Earth, with all its mountains, forests, seas, and cities, upon his head, ensuring its stability. Sesha accepted, passed beneath the Earth, and steadfastly supported the world, thus becoming the embodiment of Dharma and its unwavering foundation.","[""Sesha"", ""Brahma""]",Selfless duty born from disillusionment,"When faced with difficult relationships, seeking a higher purpose can transform personal suffering into a profound contribution to the world. True strength lies in choosing virtue and service.",2026-03-14T10:03:30.837839+00:00,[],True
mahabharat,1,16,The Prophecy of Astika's Birth,Adi Parva > Section XXXVII | Adi Parva > Section XXXVIII | Adi Parva > Section XXXIX,"The Naga snakes, led by Vasuki, are in despair after their mother Kadru curses them to perish in Janamejaya's future snake sacrifice. They hold a frantic consultation, with many proposing violent and destructive measures to avert their fate, such as killing priests or the king. Vasuki rejects these ideas, seeking a more righteous path. Elapatra, a wise snake, then reveals a divine prophecy he overheard from Brahma. Brahma had declared that while many cruel snakes would be destroyed, the virtuous ones would be saved by a son named Astika. This son would be born to the sage Jaratkaru and a woman also named Jaratkaru, who is Vasuki's sister. Based on this prophecy, Vasuki decides to carefully raise his sister, Jaratkaru, to be offered as a bride to the sage, thus initiating the long-term plan for their salvation.","[""Vasuki"", ""Elapatra"", ""Brahma"", ""Jaratkaru (Vasuki's sister)""]",Desperate search for salvation,"When faced with seemingly insurmountable problems, rash actions often lead to more harm; true solutions may require patience, wisdom, and an openness to unexpected paths.",2026-03-14T10:03:39.792655+00:00,[],True
mahabharat,1,17,King Parikshit's Insult and Sringin's Curse,Adi Parva > Section XL | Adi Parva > Section XLI,"King Parikshit, while hunting, becomes fatigued and thirsty. He encounters the sage Shamika, who is observing a vow of silence. When Parikshit asks about a lost deer and receives no reply, he feels insulted and angrily places a dead snake on the sage's shoulder. Shamika, forgiving, remains silent. Later, Shamika's young son, Sringin, learns of his father's humiliation from a friend, Krisa. Enraged by the disrespect shown to his ascetic father, Sringin, without fully understanding the circumstances, curses King Parikshit. He declares that Takshaka, the king of serpents, will bite Parikshit and take his life within seven nights. Shamika, upon hearing of the curse, expresses his displeasure, reminding Sringin of the importance of forgiveness and the king's role in protecting ascetics.","[""King Parikshit"", ""Shamika"", ""Sringin"", ""Takshaka""]",Unchecked anger and its repercussions,"Hasty reactions fueled by anger can lead to severe and irreversible consequences, often disproportionate to the initial offense. It's crucial to understand the full context before acting on strong emotions.",2026-03-14T10:03:46.746176+00:00,[],True
mahabharat,1,18,Pandu's Quest for Sons,Adi Parva > Section CXXI | Adi Parva > Section CXXII,"King Pandu, cursed to die if he attempts procreation, expresses his profound despair to Kunti about dying sonless. Kunti, recalling a boon from Durvasa that allows her to invoke gods for children, offers a solution. To illustrate the possibility of unconventional conception, she recounts the tale of King Vyushitaswa. After Vyushitaswa died sonless from excessive indulgence, his grieving wife, Bhadra, was instructed by an incorporeal voice to lie with his corpse after her ritual bath. From this union, she bore seven children. Kunti suggests Pandu could similarly beget children through her, drawing on his ascetic power, or she could use her boon. Pandu then explains the ancient practice where women had more freedom in choosing partners, a custom later changed by Swetaketu to the current monogamous norm, setting the stage for Kunti to use her boon.","[""Pandu"", ""Kunti""]",Hope for heirs,"When conventional paths are blocked, understanding historical precedents or exploring unconventional solutions can offer hope and a way to fulfill deep-seated desires, especially for family.",2026-03-14T10:03:56.400205+00:00,[],True
mahabharat,1,19,The Birth of the Pandavas,Adi Parva > Section CXXIII | Adi Parva > Section CXXIV,"Kunti, utilizing a boon from Durvasa, invokes divine fathers to bear sons for Pandu, who is under a curse preventing him from having children naturally. First, she calls upon Dharma, the god of justice, and gives birth to Yudhishthira, prophesied to be the most virtuous and a future ruler. Next, at Pandu's request for strength, she invokes Vayu, the god of wind, resulting in the birth of Bhima, whose immense power is evident when he shatters a rock upon falling as an infant. Finally, after Pandu's intense austerities, Kunti invokes Indra, the king of gods, who begets Arjuna. Arjuna is foretold to be an unparalleled warrior, destined to achieve great fame, conquer enemies, and restore the Kuru lineage. Each birth is accompanied by celestial pronouncements of the child's future greatness.","[""Kunti"", ""Pandu"", ""Yudhishthira"", ""Bhima"", ""Arjuna"", ""Dharma"", ""Vayu"", ""Indra""]",Divine blessings and hopeful anticipation,"When facing seemingly insurmountable obstacles, persistent effort and faith can open pathways to unexpected solutions and fulfill deep desires.",2026-03-14T10:04:02.431671+00:00,[],True
mahabharat,1,20,Duryodhana's First Plots and Bhima's Nectar,Adi Parva > Section CXXIV | Adi Parva > Section CXXV,"Madri, longing for children and feeling overshadowed by Kunti, appeals to Pandu. Pandu convinces Kunti to share her celestial invocation mantra, leading to Madri conceiving twin sons, Nakula and Sahadeva, from the Ashwins. Kunti, however, expresses a touch of jealousy, noting Madri gained two children from a single invocation. Some time later, during a vibrant spring, Pandu, feeling a resurgence of vitality, is overcome by intense desire for Madri. Forgetting the sage's curse that prophesied his death upon intimacy, he embraces her. Instantly, the curse takes effect, and Pandu dies in Madri's arms. Her mournful cries summon Kunti, who discovers the tragic scene, leaving the young Pandavas fatherless.","[""Pandu"", ""Kunti"", ""Madri"", ""Nakula"", ""Sahadeva""]",Tragic consequence of forgotten warning,"Ignoring known dangers, especially when driven by strong emotions, can lead to irreversible and tragic outcomes. Self-awareness and discipline are crucial for navigating life's temptations.",2026-03-14T10:04:10.421117+00:00,[],True
